评论：施一公因房贷压力请辞？正能量的造谣还是造谣,AWNN6Fx_vel9p8sC_Mbd
穆迪：中兴禁令对华为、爱立信和诺基亚构成信用利好,AWNN6KP6vel9p8sC_QSt
结构性存款规模飙至8.8万亿 为何还未有监管细则？,AWNN6TNMvel9p8sC_X3T
Versa创始人出席互联网大会 对AI做出新展望,AWNN6B4Tvel9p8sC_JQ5
重大利好能否催生A股反转行情？,AWNN6AGzvel9p8sC_H13
吴军：人工智能是一种生产力 而区块链是一种生产关系,AWNN6FL1vel9p8sC_L8V
伊朗央行禁止所有金融机构从事加密货币交易,AWNN6Mjxvel9p8sC_SM2
资本挤破头 市民蒙查查,AWNN5_zUvel9p8sC_He3
摩根士丹利华鑫基金：周期消费等板块存在结构性机会,AWNN6SWMvel9p8sC_XRn
中国大数据资产运营商九次方大数据估值或将突破100亿,AWNN6B4Tvel9p8sC_JQ4
消除信贷隐患 专家称房价下跌“有底线”,AWNN6US4vel9p8sC_Yz5
展望B端支付市场，易宝支付为产业打造创新支付平台,AWNN6KP6vel9p8sC_QSy
建第三方账户 苹果将开始向爱尔兰支付130亿欧元退税_资讯_因果财经_财经网,AWNN6Aztvel9p8sC_IUE
北京异地购房提公积金取消“异地购房证明”,AWNN6N3xvel9p8sC_Tlq
人民币正成为避险货币 俄媒:人民币计价原油期货推动明显,AWNN6M1tvel9p8sC_ScL
高盛：保险业者更青睐私募股权投资,AWNN6GT3vel9p8sC_M8q
乐视网年报披露时间推迟 净利润亏损额可能进一步扩大,AWNN6Kgavel9p8sC_QlI
特朗普：美国财政部长将访问中国 中美双方很有可能就贸易问题达成协议,AWNN6GBovel9p8sC_Mpz
香港25年来最大上市制度改革将激发资本市场新活力,AWNN6Tcwvel9p8sC_YGc
深交所也开现场新闻发布会了！宣布强化一线监管职能,AWNN6Rkgvel9p8sC_WfT
港交所重启同股不同权大门 企业WVR咨询7月底前展开,AWNN6NInvel9p8sC_S1j
技术解盘：IF绝地反击 十债步步高升,AWNN6GBovel9p8sC_Mpo
三聚环保拟定增募资不超过30亿元,AWNN6GT3vel9p8sC_M08
春和集团：“12春和债”构成实质性违约,AWNN6LwBvel9p8sC_RiL
债券承销业务向信托公司“开闸”,AWNN6S6Rvel9p8sC_XpN
你的钱袋子受到降准影响了吗？对房贷利率影响比较小,AWNN6TNNvel9p8sC_X-y
海特高新：海威华芯达成预期经营目标还需开展大量工作,AWNN6COcvel9p8sC_JgQ
美债“破3”或导致大量资金涌入科技股,AWNN6Kgavel9p8sC_Qln
央行：所有ICO平台和比特币交易所已经退出中国市场,AWNN6NInvel9p8sC_S2a
看清募投项目变更背后玄机 重点关注资金用途,AWNN6OJWvel9p8sC_Tyc
巨丰微策略：创业板或迎新一轮反弹,AWNN6Gogvel9p8sC_NL2
信披涉嫌违规拟被罚 国民技术5亿“打水漂”业绩转亏,AWNN6Mjyvel9p8sC_SUV
特朗普:美财长将访华进行贸易谈判 双方或达成协议,AWNN6OwPvel9p8sC_UUe
警惕10类“理财”项目 守好自己的钱袋子,AWNN6Gogvel9p8sC_NEE
投资机构连续加磅，九次方大数据2018年市场估值或达100亿以上_商讯_产经频道首页_财经网,AWNN6Mjyvel9p8sC_SPY
财政部发文加强会计诚信建设：严重失信将列黑名单,AWNN5_zUvel9p8sC_HmS
互金协会制定网贷电子合同标准 合同签订后需第三方存储,AWNN6COcvel9p8sC_JgI
国务院办公厅：深入推进供给侧结构性改革等重大部署,AWNN6GBovel9p8sC_MtT
习近平：着力解决发展不平衡不充分的问题,AWNN6COcvel9p8sC_JgT
中国原油期货震荡收跌但整体交易活跃 油价后市仍处易涨难跌状态,AWNN5_zUvel9p8sC_Hma
证监会：进一步完善绿色债券标准,AWNN6MUtvel9p8sC_SHu
互联网平台场外个股期权交易服务 普通投资者能否参与？,AWNN6COdvel9p8sC_Jod
银联移动支付实现沪杭涌高速自助智能收费站点覆盖,AWNN6N3xvel9p8sC_TiW
神州租车保险问题被曝光 违背自愿投保原则等仍待解_保险_金融频道首页_财经网,AWNN6Nm5vel9p8sC_TUO
京东方A：全球面板市场进入寡头竞争势态,AWNN6Bpzvel9p8sC_JJM
央行专家提&quot;六个钱包买房&quot; 为何戳中年轻人的心？,AWNN6TNMvel9p8sC_X4b
借贷宝谈智慧城市建设：布局并推进AI落地各领域_商讯_产经频道首页_财经网,AWNN6C3ivel9p8sC_J_Z
十倍杠杆！连年亏损的鲍尔森已经陷入“赌徒模式”？,AWNN6Kgavel9p8sC_QlN
乐视网：公司被起诉涉案金额超33亿_上市公司_证券频道首页_财经网,AWNN6KBxvel9p8sC_QGb
上证底部构筑中 历史性机遇或将到来,AWNN6N3xvel9p8sC_Tib
习近平：着力解决发展不平衡不充分的问题_经济_宏观频道首页_财经网,AWNN6Gogvel9p8sC_NEw
乐视网：公司目前涉诉讼案件总金额超33亿元,AWNN6MUsvel9p8sC_SGb
火星探测计划正在有序推进 关注相关概念股,AWNN6ZfXvel9p8sC_dYi
贸易战让美消费者躺枪 德媒：中国产品几乎无法替代,AWNN6COdvel9p8sC_Jn9
【股指期市数据】期指再度回落 维持偏空操作,AWNN6Oftvel9p8sC_UE5
建设全岛自贸区，稳步推进自贸港，坐看海南富起来,AWNN5-tYvel9p8sC_GgX
海南实现全域限购 房地产政策调控升级,AWNN6OJVvel9p8sC_TqY
金融开放大趋势下 要从源头上管控过度金融关联交易,AWNN6S6Qvel9p8sC_XmO
港交所公布IPO新规：允许同股不同权 重大事宜须一股一票表决,AWNN6Rkgvel9p8sC_Wao
港股25年最重大改革，港交所下周始接受“同股不同权”上市申请,AWNN6TNMvel9p8sC_X4-
乐视网(300104.SZ)延期披露年报 净亏损或进一步扩大 中国市场新闻,AWNN6OJWvel9p8sC_TyN
人民币正成避险货币 俄媒：人民币计价原油期货推动,AWNN6Kgavel9p8sC_Qin
香港金管局:港元联系汇率制度稳定 港元汇率缓慢上升,AWNN6LIvvel9p8sC_RBo
斯沃琪CEO：阿里巴巴在打击假货上比亚马逊做得好,AWNN6MCwvel9p8sC_Rxw
市场评论政策利好激发做多热情 蓝筹股风云再起？,AWNN6SH0vel9p8sC_W_G
央企公司制改制基本完成 历史性突破打开改革新空间,AWNN6OJWvel9p8sC_TtI
在岸人民币官方收盘价报6.3000 较上一日收盘跌44点,AWNN6ChTvel9p8sC_Jv4
央行今日净回笼1500亿元 今起对银行定向降准置换MLF,AWNN6OJWvel9p8sC_TyH
外媒：中美贸易摩擦 欧元区恐“受伤”,AWNN6R5evel9p8sC_Wo3
央行今日下调部分金融机构存款准备金率,AWNN6IXJvel9p8sC_OoE
监管直指互联网资管乱象 黄金钱包迎合规难题,AWNN6MCwvel9p8sC_R00
中国互金协会：网贷机构电子合同应委托第三方存储,AWNN6OJWvel9p8sC_T1n
扩张性货币政策埋下隐患！一场货币危机要来临？,AWNN6Fx_vel9p8sC_McD
比特币今日价格强势攻下9700美元 比特币行情走势图无惧监管压力！,AWNN6NInvel9p8sC_SyU
海南楼市调控：短期“壮士断腕” 长期红利可观,AWNN6MCwvel9p8sC_R4Y
央行：不开展公开市场操作 净回笼1500亿元,AWNN6HfEvel9p8sC_N8p
火狼论金：黄金反弹并无力量，后市还是空,AWNN6C3ivel9p8sC_J6s
国资委：央企公司制改革已基本完成,AWNN6HNGvel9p8sC_NtJ
5G概念股强势 多股涨停,AWNN6HfEvel9p8sC_N8j
沪深两市全线上涨 创业板指数涨逾３％,AWNN6LYevel9p8sC_RXD
特朗普：美国财政部长将访问中国 中美双方很有可能就贸易问题达成协,AWNN6MCwvel9p8sC_R0_
供应链金融金投手：金融科技赋能互金 机遇挑战并存,AWNN6LYevel9p8sC_RZD
乐视网：被起诉类案件合计涉案金额超33亿元人民币,AWNN6HNGvel9p8sC_NlN
港交所：不同投票权股份的投票权不得超过普通投票权10倍,AWNN6Jtqvel9p8sC_P3x
银保监会临时摸底地方资产管理公司运营风险,AWNN6HNGvel9p8sC_Nsq
互贷网理财研究院：想实现财务自由，现在的你该怎样做呢？,AWNN6Ui7vel9p8sC_ZOw
媒体：中国本周可能发布资产管理业务新规,AWNN6Jtqvel9p8sC_P-k
工信部：集成电路发展基金正在进行第二期募集资金,AWNN6I4Hvel9p8sC_PPa
互联网金融与传统金融的竞争与合作,AWNN6MCwvel9p8sC_Rz7
亚盘回顾：金价徘徊于1330附近 新债王称黄金正处于爆发边缘,AWNN6LwBvel9p8sC_RlN
大举抄底金融、地产、家电等蓝筹股 境外资金近一个月净流入450多亿,AWNN6N3xvel9p8sC_Tlz
上交所、中国结算联合发布实施债券质押式三方回购交易结算暂行办法,AWNN6Fi0vel9p8sC_MMJ
上海期货交易所积极研究汽柴油期货、天然气期货,AWNN6Inzvel9p8sC_O7J
中国拟设首个金融法院，增强中国金融司法国际影响力，为啥选在上海？,AWNN6N3xvel9p8sC_Tl8
美媒称贸易战爆发不止影响中美：改变其他经济体命运,AWNN6Rkgvel9p8sC_Wfo
博鳌论坛释放互金发展信号 合众e贷锻造合规创新坚实双翼,AWNN6RSBvel9p8sC_WS-
住房租赁资产证券化落地试点发行REITs,AWNN6W4ivel9p8sC_bDX
美债美股等波动影响深刻 A股受影响几何,AWNN6LYevel9p8sC_RV2
“新三板+H”涟漪： 企业细算成本风险,AWNN6V81vel9p8sC_aQV
银保监会提示 “保本高收益”保险销售陷阱,AWNN6Tunvel9p8sC_YVG
近期楼市有新意：政府鼓励搞租赁 大V高喊“六个钱包”去买房,AWNN6Wkivel9p8sC_a6Y
证监会：推进住房租赁资产证券化 雄安新区等优先,AWNN6XLuvel9p8sC_bRf
住房租赁资产 证券化加速 大中城市优先,AWNN6aXCvel9p8sC_eBI
普华永道：互联网行业吸金能力强，区块链等新业态成主要驱动力,AWNN6PEjvel9p8sC_Ub8
特朗普：美国近期将派代表团赴华磋商贸易问题,AWNN6K5Ovel9p8sC_Q4C
东方同信因经营业绩异常波动 被提示风险,AWNN6Yqqvel9p8sC_chi
上交所：鼓励和支持符合条件的绿色企业上市融资,AWNN6Wkhvel9p8sC_ayd
提高收入解决住房问题 上海着力提升产业工人获得感,AWNN6W4ivel9p8sC_a93
住房租赁资产证券化加速 大中城市优先,AWNN6Uyovel9p8sC_ZeI
摩根大通期货：中国原油期货价格已体现对冲意义,AWNN6ZvYvel9p8sC_dfw
被起诉涉案金额超33亿， 乐视网延期发布年报！,AWNN6Gohvel9p8sC_NN5
银保监会：保险从业者销售非保险金融产品 别买！,AWNN6VeSvel9p8sC_Z9H
上市公司重大事项表决前应积极与中小投资者沟通,AWNN6a78vel9p8sC_ecr
推进住房租赁资产证券化 审核设“绿色通道”,AWNN6Wkhvel9p8sC_ayK
央行下调部分金融机构存款准备金率 暂停逆回购,AWNN6aDxvel9p8sC_dxS
拓宽机构融资渠道 ABS发行成本有望降低,AWNN6Tcxvel9p8sC_YMv
年内超八成债券基金正收益 业内人士称债市慢牛可期,AWNN6aqIvel9p8sC_eQC
微信支付出现新骗局 有人利用软件生成支付记录,AWNN6G90vel9p8sC_NVS
9家上市券商“晒”一季报 经纪投行承压 龙头业绩稳定,AWNN6aXBvel9p8sC_eAt
中国拟设金融法院 将建立完善金融审判专家辅助制度,AWNN6PEjvel9p8sC_Uj8
降准首日资金面略有缓解 机构看好中长期债市行情,AWNN6W4ivel9p8sC_bB9
工信部：年内取消新能源汽车外资股比限制,AWNN6VeSvel9p8sC_Z16
新华社：稳步推进自由贸易港建设应做好制度设计,AWNN6UBnvel9p8sC_Ywo
证监会、住建部：推进住房租赁资产证券化 审核设绿色通道,AWNN6R5fvel9p8sC_Wz2
雄安规划落地催生资金需求 银行进驻未来之城创新当先,AWNN6VtJvel9p8sC_aAp
重磅！首款国产太赫兹芯片发布，有哪些相关概念股？,AWNN6EpSvel9p8sC_LW6
金储宝：“安全性”是互金平台的竞争标杆,AWNN6Nm5vel9p8sC_TSp
短期理财债基规模猛增 未来或面临转型考验,AWNN6Wkivel9p8sC_a6p
美国调查华为是否违反对伊朗制裁规定 华为称已遵守,AWNN6V81vel9p8sC_ad3
美国10年期国债收益率继续上涨 欧洲股市全线低开,AWNN6OJWvel9p8sC_Tr2
财政部：政府不得向社会资本承诺固定或最低收益回报,AWNN6VtKvel9p8sC_aO8
弱势震荡格局再现 密切关注成交量变化,AWNN6V81vel9p8sC_aWG
资本支持租购并举政策落地 ABS租赁企业将获激励,AWNN6VJOvel9p8sC_Zih
社交网络用上区块链和代币 能解决FB的隐私难题吗,AWNN6Yqqvel9p8sC_cpM
证监会住建部联合发布通知 推进住房租赁资产证券化,AWNN6Tcwvel9p8sC_YIY
汇证：预计部分内房股今年仍强 吁“买入”融创、龙湖地产等,AWNN6Yqqvel9p8sC_cpN
资管新规预计出台时间 资管新规对股市的影响怎样,AWNN6VtJvel9p8sC_aGf
业绩突破进入收获期 解码兆驰股份三大生态布局,AWNN6EJjvel9p8sC_K_T
IPO新规有利于提升港交所吸引力与竞争力,AWNN6Uyovel9p8sC_ZTO
央行联手最高法院等11部门 集中打击新型非法集资,AWNN6OwOvel9p8sC_URh
坐不住了！苹果CEO库克即将找特朗普谈贸易战,AWNN6Wkivel9p8sC_a9j
外交部：欢迎美方来访就中美经贸问题进行对话磋商,AWNN6aqIvel9p8sC_ePF
强监管下互联网巨头的估值为何逆势飙涨,AWNN6YZwvel9p8sC_cZZ
乐视牵手刘强东与京东谈合作！乐视网能否化危为机？,AWNN6VtJvel9p8sC_aLo
两部门：优先支持雄安租赁住房项目开展资产证券化,AWNN6Kgavel9p8sC_QoP
黄金价格下跌 因美元走强且美债收益率创2014年以来最高水平,AWNN6VtJvel9p8sC_aE6
外媒称美国司法部正调查华为 美国AMD等芯片制造商股价下跌,AWNN6VJOvel9p8sC_Zqa
公募基金一季报收官 绩优股基偏爱创业板,AWNN6VeSvel9p8sC_Z9b
证监会:支持雄安等政策支持区域住房租赁资产证券化,AWNN6Kgavel9p8sC_Qof
共享单车迎来重监管 过量投放或将上黑名单,AWNN6OJWvel9p8sC_TsG
国债涨势开启 建议以逢低买入策略为主,AWNN6N3xvel9p8sC_Tgs
新乐视智家更名后与京东达成合作 资金交割存疑,AWNN6PW2vel9p8sC_UyB
优先支持大中城市 住房租赁资产证券化落地,AWNN6YZwvel9p8sC_cWe
华夏信财李彬出席朗迪美国峰会，分享“我眼中的中国特色普惠金融”,AWNN6VeTvel9p8sC_Z_N
住房租赁资产证券化落地 四大亮点抢先看！,AWNN6Tunvel9p8sC_YeI
国务院再减税600亿 降低创业创新成本,AWNN6US4vel9p8sC_Y_T
国家电网与中国铁塔战略合作 输电塔将设通信网络,AWNN6Q6jvel9p8sC_WAG
A股环保风暴信号:环境部证监会联手打击污染或成常态,AWNN6SH0vel9p8sC_W9N
USGFX联准国际：日央行老调重弹 支持继续实施宽松政策,AWNN6E4Bvel9p8sC_Lmp
环境部着力发展绿色金融 上交所推绿色企业“新蓝筹”名单,AWNN6Oftvel9p8sC_UH8
汽车租赁市场保险乱象受关注 神州租车悄整改争议问题,AWNN6Tcxvel9p8sC_YP6
三部委联合发文：鼓励运用PPP改善旅游服务供给,AWNN6Tcwvel9p8sC_YD0
纳斯达克CEO：如果条件成熟 不排除“成为数字货币交易所”,AWNN6Tcxvel9p8sC_YQP
两市开盘涨跌互现 房屋租赁板块升温,AWNN6Tcwvel9p8sC_YG6
财通资管固收近半年绝对收益、超额收益双料第一,AWNN6VeSvel9p8sC_Z6B
杭州严控“类住宅” 一商业地块规定不得建酒店式公寓,AWNN6X2fvel9p8sC_b3k
黄金交易提醒：金价1320生死线，韩朝会晤料落井下石,AWNN6Tcxvel9p8sC_YQb
银行大额存单利率猛涨 最高上浮幅度超过50%,AWNN6Tcwvel9p8sC_YDT
房屋租赁板块大幅领涨 1股涨停,AWNN6UBnvel9p8sC_Yi4
优化税收营商环境 促进实体经济发展,AWNN6VJOvel9p8sC_ZsU
美国赴华贸易代表团将至，团里对华强硬“三巨头”一个都没少,AWNN6VeSvel9p8sC_Z6N
制造业补短板迫在眉睫 将启动一批重大短板装备项目,AWNN6VJOvel9p8sC_Zoz
路透：监管层检查银行业乱象 严查信贷资金进入楼市,AWNN6OJWvel9p8sC_Twy
雄安新区规划落地催生资金需求 探索房地产金融产品,AWNN6VJOvel9p8sC_Zo1
美国要限制中国对美投资？商务部:已做好应对准备,AWNN6E4Bvel9p8sC_Lxr
去IOE板块大涨 华东电脑涨幅居前,AWNN6TNNvel9p8sC_X7v
商务部：按照底线思维方式 做好应对任何可能的准备,AWNN6VeSvel9p8sC_Zw4
预计IC相对偏强 尝试多IC空IH套利操作,AWNN6XLuvel9p8sC_bZe
独角兽公司来袭 套路还是机遇？,AWNN6UBnvel9p8sC_Yq3
央行支付司官员喊话支付巨头：不要以为自己大而不能管,AWNN6OJWvel9p8sC_Twu
商务部：中方坚决反对任何形式的单边主义和保护主义,AWNN6Gohvel9p8sC_NRI
美国要遏制中国收购其敏感技术？商务部回应,AWNN6G90vel9p8sC_NYh
商务部：会同相关部门抓紧研究以雄安新区为核心的河北自贸区总体方案,AWNN6G90vel9p8sC_NYf
中国原油期货上市满月 国内原油期货价格创新高成绩亮眼,AWNN6WUtvel9p8sC_al-
央行：依法加强和改进反洗钱监管,AWNN6WUtvel9p8sC_ate
警惕借保险名义推销高收益P2P产品,AWNN6YZwvel9p8sC_cTU
日线反弹昙花一现！现货黄金终究难躲一劫？,AWNN6VJOvel9p8sC_Zkd
资产证券化支持集体土地租赁房,AWNN6VJOvel9p8sC_Zq8
央行：持续加强反洗钱监管和调查协查,AWNN6YZwvel9p8sC_cTI
商务部:敦促美方尊重世贸规则 通过平等对话和磋商解决分歧,AWNN6In0vel9p8sC_O-W
保险业全球化与中资保险公司的发展进路,AWNN6Uyovel9p8sC_Zc3
特朗普称美朝正良好磋商 赞金正恩“开放且可敬”,AWNN6Rkgvel9p8sC_WfY
消息称小米下周提交赴港IPO申请,AWNN6VtJvel9p8sC_aBu
民信贷：区块链+金融何时落地？_商讯_产经频道首页_财经网,AWNN6W4ivel9p8sC_bHF
商务部：中印经济互补性较强 合作潜力巨大,AWNN6VeSvel9p8sC_Z4x
"港股策略:H股“全流通”加速,赴港上市的路越来越宽",AWNN6eIlvel9p8sC_g_c
"融资融券周报:融资资金流出,配置转向防守",AWNN6dEcvel9p8sC_gIr
中软国际回应股价大跌：和华为在美无合作 相信华为,AWNN6V81vel9p8sC_acq
国产自主可控势在必行 三主线掘金,AWNN6R5evel9p8sC_WnP
中消协：社会类培训领域“卷包跑路”风险正在累积,AWNN6XLuvel9p8sC_bOo
三大股指午后弱势震荡 稀土板块跌幅居前,AWNN6Uyovel9p8sC_ZRi
吴敬琏谈中兴事件：不惜一切代价发展芯片产业是危险的,AWNN6GT3vel9p8sC_M5o
大资金买股新动向 你的股票上榜了吗,AWNN6YJ5vel9p8sC_cLv
特朗普炮轰油价站不住脚？油价近期涨势凶猛的“幕后推手”竟是它,AWNN6US4vel9p8sC_Y6c
中国互金协会下发逾期债务催收自律公约 现场催收应全程录音或录像,AWNN6Gohvel9p8sC_NPI
我国拟在上海设立金融法院 强化金融司法保障,AWNN6XLuvel9p8sC_bTJ
定了！巨潮金融携手上饶银行 正式签署银行存管协议,AWNN6R5fvel9p8sC_W0D
这一年，关于金融习近平都讲了什么？,AWNN6XLuvel9p8sC_bRb
中金：港交所上市新规和CDR非零和博弈 上望400元,AWNN6Tunvel9p8sC_YTM
资金动向有玄机 沪深港通有亮点,AWNN6Ql7vel9p8sC_VpN
央行：不断完善法律制度 依法加强和改进反洗钱监管,AWNN6Ui7vel9p8sC_ZJt
支付宝“多收多保”存在重大漏洞！马云：白给还不要？,AWNN6QUjvel9p8sC_VhR
央行部署反洗钱工作：提升反洗钱监测分析水平 加强国际合作,AWNN6Rkgvel9p8sC_WkZ
腾讯音乐或赴美IPO 音乐流媒 体市场趋向寡头化,AWNN6dEcvel9p8sC_gKU
A股大揭秘 怎么就涨不起来？,AWNN6QUjvel9p8sC_VeE
百度发布金融云战略,AWNN6YJ5vel9p8sC_cIb
中国正战略性投资黄金 普通投资者如何选择？,AWNN6I4Gvel9p8sC_PGE
深股通净流出逾30亿元 创开通以来最高记录,AWNN6Ui7vel9p8sC_ZJe
美媒：滴滴最快下半年上市 估值或达800亿美元,AWNN6US4vel9p8sC_Y57
中国社科院报告：三四线城市房价仍将继续惯性上涨,AWNN6SHzvel9p8sC_W7i
第三种尝试：区块链之上有画廊_商讯_产经频道首页_财经网,AWNN6GT3vel9p8sC_NBN
中国扩大金融开放，全球资本市场将迎来“头号玩家” _商讯_产经频道首页_财经网,AWNN6Slqvel9p8sC_XUu
盘后机构策略：逢低仍有继续低吸机会,AWNN6RSBvel9p8sC_WUv
美媒：中美贸易摩擦波及全球产业链 四地受影响最大,AWNN6In0vel9p8sC_O-I
从CDR新规到港交所IPO新规改革为何频现,AWNN6PW2vel9p8sC_UqY
中国软件股价涨幅过大 26日起停牌核查,AWNN6dXsvel9p8sC_gdH
比特币最新消息：比特币价格大涨7%再迫近1万美元 比特币将再度上演辉煌？,AWNN6Gohvel9p8sC_NQ4
黄金交易革命：这家公司准备在黄金整个流程中布局区块链,AWNN6HNGvel9p8sC_Nmb
货币政策“精准施针”渐成常态,AWNN6Ui7vel9p8sC_ZJ7
社科院：三四线城市房价仍惯性涨 3月北京房价回升,AWNN6GT3vel9p8sC_M_k
防控信用风险 债市新规强化主承销商责任,AWNN6Aztvel9p8sC_IQw
深度融合实体经济 大数据成数字时代新引擎,AWNN6Gogvel9p8sC_NHn
政策机遇下的海南楼市：短期内“壮士断腕”长远看红利可期,AWNN6HNGvel9p8sC_NuQ
黄金难逃近五周低点羁绊，美债美元联手上演泰山压顶,AWNN6Gohvel9p8sC_NQ3
人行：完善反洗钱法律制度 提升机构风险管理水平,AWNN6I4Gvel9p8sC_PGb
人行研究局局长徐忠：房地产税可打破楼价长涨预期,AWNN6In0vel9p8sC_O-e
美方调查转为持久战：华为想要出淤泥不染真的很难,AWNN6IXJvel9p8sC_Osw
外交部：希望美方不要做进一步损害外国投资者信心的事,AWNN6S6Qvel9p8sC_XkG
港交所新主席史美伦:交易所竞争激烈 与内地深入合作,AWNN6C3ivel9p8sC_J8D
济南楼市放“大招”：优先满足刚需购房禁止“要求一次性付款或一次性付款优先选房”,AWNN6XLuvel9p8sC_bYA
人民币连五日收跌至逾一个月新低 预期分化未现恐慌购汇,AWNN6QUkvel9p8sC_Vlj
央行：进一步提升反洗钱检测分析水平,AWNN6XLuvel9p8sC_bQX
