游戏理财诈骗玩了5年仍未绝迹 国家互金专委会再发“警报”,AWNN51Auvel9p8sC--QK
特朗普再放“嘴炮”指责OPEC人为控市 油价周五盘中承压回落,AWNN50qxvel9p8sC-9-r
H股“全流通”试点启动 联想控股尝头啖汤“全流通”,AWNN5yGJvel9p8sC-71m
银保监会：一季度处罚银保公司646家 罚没金额合计11.58亿元,AWNN5ynbvel9p8sC-8Pq
黄金日内交易分析：金价随机波动抵达超卖区域 预期上涨,AWNN5ynbvel9p8sC-8Pe
玻利瓦尔币狂贬 委内瑞拉比特币交易量创下记录新高,AWNN5yGJvel9p8sC-77s
联想控股尝鲜H股全流通 A+H上市公司有望长期受益,AWNN5zLDvel9p8sC-8vP
H股“全流通”试点启动 改革方案不一定有“对价”,AWNN5yV_vel9p8sC-8FN
中兴通讯：反对将贸易问题政治化,AWNN5yV_vel9p8sC-8DW
朝鲜再放缓和信号 比特币涨幅收窄,AWNN50Y7vel9p8sC-91E
H股全流通试点业务实施细则出炉 联想控股为首家试点企业,AWNN5yV_vel9p8sC-8AJ
私募违法违规五花八门 八起案件进入行政处罚审理程序,AWNN5ynbvel9p8sC-8a5
商务部：对原产美国等进口浆粕继续实施反倾销措施,AWNN5zLDvel9p8sC-8vN
证监会：坚决打击私募基金领域违法乱象,AWNN5ynbvel9p8sC-8TU
金正恩宣布朝鲜新战略路线 朝鲜从21日起不再进行核导试验,AWNN5zLDvel9p8sC-8zX
证监会：正式推出首家H股“全流通”试点,AWNN5ynbvel9p8sC-8N_
区块链技术应用发展何去何从,AWNN53itvel9p8sC_AcU
普陀山拟IPO说明了什么问题,AWNN5xx3vel9p8sC-7iT
新疆兵团新一轮国资改革启动 积极推进混改和并购重组,AWNN5yV_vel9p8sC-8Bl
联想控股：正与中国证监会就H股全流通试点申请的细节进行讨论,AWNN5ynbvel9p8sC-8QA
苹果幕后推动 美反垄断机构对该国四大运营商发起调查,AWNN5ynbvel9p8sC-8cM
喧闹之后 海南板块终将回归平静,AWNN5ynbvel9p8sC-8OQ
国家发改委部署2018年重点领域化解过剩产能工作,AWNN53itvel9p8sC_Afz
国家发改委公布降低一般工商业电价首批措施,AWNN6C3ivel9p8sC_J7D
皮海洲：“独角兽”募资也别太任性,AWNN57zpvel9p8sC_ELg
驻美大使:贸易是互相获利的 贸易战只能毁掉贸易,AWNN5ynbvel9p8sC-8UW
乐视网4天暴涨超30% 炒作问题股票无异于纵容作奸犯科,AWNN5xx3vel9p8sC-7lz
中兴通讯：美禁令对中兴通讯极不公平，不能接受,AWNN53iuvel9p8sC_Akz
深交所：对参与乐视网股票炒作的8个账户采取监管措施,AWNN5ynbvel9p8sC-8U3
485股获买入评级 68只股或涨超50%,AWNN5xx3vel9p8sC-7j_
证券时报头版评论：炒作问题公司股票无异于纵容作奸犯科,AWNN5ynbvel9p8sC-8Uc
210股机构首次关注 荣盛石化涨幅空间最大,AWNN5yGJvel9p8sC-787
1529公司预告一季度业绩 392家增幅翻倍,AWNN5yV_vel9p8sC-8K8
从财务分析角度分析中兴通讯为何铤而走险？,AWNN5zLDvel9p8sC-81A
公告隐现重大利好 周一8只个股有望突破大涨,AWNN5yGJvel9p8sC-785
独角兽“减肥上市”说明了什么？,AWNN5y6Nvel9p8sC-8rn
下周解禁市值1255.51亿元 环比上升611.22%,AWNN50Y7vel9p8sC-91T
中国驻美大使崔天凯：贸易战只能毁掉贸易,AWNN5zc9vel9p8sC-8-9
上海新政整治现金贷 第三方助贷“断路”,AWNN51Auvel9p8sC--Xj
侠客岛:特朗普发动贸易战 他的意图绝没那么简单,AWNN53POvel9p8sC_AU3
中国首家DIY智慧银行开业 智慧金融服务等你体验,AWNN54C0vel9p8sC_A9O
朝鲜将集中全部力量发展经济 提高人民生活水平,AWNN53ASvel9p8sC_AAo
杭州：力争到2020年境内外上市公司达235家,AWNN5xx3vel9p8sC-7rr
个人住房贷款借款人最高年龄延长至70岁,AWNN54C0vel9p8sC_A9U
华夏幸福11项议案获股东大会通过 2018年销售目标2100亿,AWNN5xx3vel9p8sC-7kR
有上游企业给相关生产线员工放假 中兴通讯事件连锁反应,AWNN5yV_vel9p8sC-8H4
IMF官员警告贸易摩擦升级将损害亚太经济,AWNN5yV_vel9p8sC-8LH
黄金技术分析：短线看跌 跌破一水平将产生强劲利空信号,AWNN53ASvel9p8sC_AE9
德国最大银行手误转账2000亿给他人，甚至超过该银行市值,AWNN5y6Nvel9p8sC-8fs
富国银行因损害消费者权益被罚10亿美元,AWNN53yAvel9p8sC_At5
IMF春季年会：所有国家都紧盯中美贸易战 但毫无缓解迹象,AWNN5yV_vel9p8sC-8K_
中兴如何翻盘？携自研迅龙芯与中兴OS登场才是上策,AWNN5yV_vel9p8sC-7-8
海南提高公积金贷款首付比例抑制房价过快增长,AWNN53ASvel9p8sC-_7l
G20财长和央行行长会议讨论贸易争端对全球经济影响,AWNN5xx3vel9p8sC-7nk
“新三板+H股”正式落地,AWNN5ynbvel9p8sC-8ZG
黄金期货买多遇阻 下周金价破局存疑,AWNN5y6Nvel9p8sC-8m7
房贷封顶年限延长5年 300万贷款利息多近56万,AWNN53POvel9p8sC_AMm
港交所与新三板签约合作，创新企业迎“新三板+H股”上市新模式,AWNN5yV_vel9p8sC-8Do
土耳其作出重大决定 全球迎来黄金回流潮,AWNN53ASvel9p8sC-_7y
汇银解盘：4.21黄金为什么会暴跌？原油下周会涨吗，如何解套,AWNN6BEZvel9p8sC_Ip7
亚洲开发银行：2018年中国经济增长率将达到6.6%,AWNN5zLDvel9p8sC-8tp
陆股通连续14个交易日净流入 买了什么？卖了什么？,AWNN60yFvel9p8sC_zxJ
预盈变巨亏近37亿 大股东精准减持！坚瑞沃能你要闹哪样？,AWNN627avel9p8sC_1rO
急套现！海航接近原价出清广州农商行股权 下半年还将直面大量到期债券“重压”,AWNN62bbvel9p8sC_1Po
政经乱局频送保护伞 黄金多头无惧美债收益率飙升,AWNN64U_vel9p8sC_25J
涉嫌信披违法违规 *ST三维遭山西证监局立案调查,AWNN64Flvel9p8sC_2mS
楼市会是降准最大受益者？媒体：别误读了降准信号,AWNN613-vel9p8sC_0sj
国际原油价格创近三年半新高 四主线掘金受益股投资机会,AWNN63jTvel9p8sC_2ER
两天5家私募被注销资格 东方银商实控人在越南被抓,AWNN64Flvel9p8sC_2oM
四大佛教名山“齐聚”A股遇阻IPO审核从严成常态,AWNN627avel9p8sC_1rU
风险“四面开花” 基金子公司苦战“违约潮”,AWNN62bavel9p8sC_1GW
隔夜外盘：欧美股市涨跌互现 美债收益率飙升芯片股重挫,AWNN51Auvel9p8sC--Zc
商务部：已做好应对准备不希望中美贸易摩擦升级,AWNN6wLvvel9p8sC_v8r
75%的超级富豪预测美国经济将在未来两年陷入衰退,AWNN63jUvel9p8sC_2IV
新华社：中国如何突破“缺芯”困境 专家建议证监会给绿色通道,AWNN62bavel9p8sC_1J-
又一家“同仁堂”筹谋登陆A股 津同仁堂冲刺A股IPO,AWNN50Y7vel9p8sC-9vI
A股芯片公司有多弱？全行业净利润、市值加起来比不上贵州茅台，连英特尔一半都不到,AWNN63jUvel9p8sC_2NR
IPO严审“吓”退百余家企业 320家公司在排队,AWNN63jUvel9p8sC_2O5
“独角兽”冷思考：真正能踏上IPO快车道的有多少,AWNN64U_vel9p8sC_20C
Hibor利率走高逼退套利交易 港汇现2个月来最大涨幅,AWNN62rXvel9p8sC_1dd
全球股市将全面崩盘？高盛：现在担心这个问题还为时过早,AWNN60yFvel9p8sC_z06
白银市场疑似上演大型逼空事件！本周COT报告值得关注,AWNN51Wivel9p8sC--l3
北京二手房成交量回升 价格连续11个月下降,AWNN63jUvel9p8sC_2Tv
多路巨头缘何投新乐视智家 估值大幅缩水被调整为90亿,AWNN631gvel9p8sC_2Vv
1600亿美元！蚂蚁金服成全球估值最大独角兽公司,AWNN64Flvel9p8sC_2xg
京东金融“不做金融”的真相：收入结构改变、“去资产化”转型_互联互通_移动互联_科技频道首页_财经网,AWNN63jUvel9p8sC_2Lw
贾跃亭回国造车的金主魅影：香港放债公司持有恒大多笔股权,AWNN52xAvel9p8sC-_25
雄安概念股拉升 北京科锐一度涨停,AWNN52f6vel9p8sC-_cv
阿里买下中天微布局AI芯片 但称收购乐鑫信息是谣言,AWNN51ngvel9p8sC--r7
乐视网再度涨停：已连续第4日上涨 本周共涨停3日,AWNN517kvel9p8sC-_AH
大爆发的边缘！大宗商品距离牛市仅咫尺之遥,AWNN52QPvel9p8sC-_OO
证监会：证券期货两类失信行为人禁止乘坐高铁高级别席位,AWNN50Y7vel9p8sC-9yZ
央行：一季度末个人住房贷款余额同比增长20%,AWNN50Gnvel9p8sC-9pJ
原油多头结束近期攻势 待特朗普放大招卷土重来？,AWNN53iuvel9p8sC_Ai5
“沉睡”已久的外汇交易苏醒！如今主宰货币走势的是它,AWNN51Wivel9p8sC--dq
证监会：对10家审计机构和9家评估机构采取行政监管措施,AWNN50Gnvel9p8sC-9iS
银保监会：从根本上、源头上遏制金融乱象的发生,AWNN51ngvel9p8sC--vN
欧盟将中国产钢索和钢缆反倾销税延期五年,AWNN517kvel9p8sC-_D5
上交所：向证监会上报10起涉嫌违法违规案件线索,AWNN5zc9vel9p8sC-9Jc
雄安新区：建立租购并举的住房制度和房地产调控长效机制,AWNN51Auvel9p8sC--TC
